<?xml version="1.0" ?><!DOCTYPE inventory  SYSTEM 'inventory.dtd'><inventory lemma="portray-v">
    <commentary>
    </commentary>
    <sense group="1" n="1" name="describe or depict someone or something" type="">
        <commentary>
        </commentary>
        <examples>
            The book portrays the actor as a selfish person.
            The father is portrayed as a good-looking man in this painting.
            Sophocles allegedly said that he portrayed his characters as they ought to be, Euripides as they are.
            It accurately portrayed what I have experienced as a Brown oarsman.
            I found out that the movie accurately portrayed what actually happened that year.
            Does the Flight Simulator accurately portray how to handle a C172?
            Next to the angel the painter portrayed a cherub with the palm frond.
        </examples>
        <mappings>
            <gr_sense/>
            <wn version="3.0">1,2,4</wn>
            <wn lemma="" version=""/>
            <omega/>
            <pb>portray.01</pb>
            <vn>characterize-29.2-1-1</vn><fn>Communicate_categorization</fn>
        </mappings>
        <SENSE_META clarity=""/>
    </sense>
    <sense group="1" n="2" name="enact, play the role of" type="">
        <commentary>
        </commentary>
        <examples>
            The actor portrays an elderly, lonely man.
            The core acting company member will portray the scheming blackmailer Krogstad.
        </examples>
        <mappings>
            <gr_sense/>
            <wn version="3.0">3</wn>
            <wn lemma="" version=""/>
            <omega/>
            <pb/>
            <vn/>
            <fn/>
        </mappings>
        <SENSE_META clarity=""/>
    </sense>
<sense group="1" n="3" name="none of the above" type="">
  <commentary>
Automatically generated NOTA sense (bbn)
  </commentary>
  <examples>
  </examples>
  <mappings>
    <wn version="2.1"></wn>
    <omega></omega><pb></pb>
    <fn></fn>
  </mappings><SENSE_META clarity=""/>
</sense>
    <WORD_META authors="duffielc,brownsw" sample_score="-"/>

<ita count="35" ann_1_2_agreement="0.742857142857" />
</inventory>
