<?xml version="1.0" ?><!DOCTYPE inventory  SYSTEM 'inventory.dtd'><inventory lemma="shape-v">
    <commentary>
    </commentary>
    <sense group="1" n="1" name="form or make something" type="">
        <commentary>
            The shaper has complete control over the final shape.
        </commentary>
        <examples>
            She shaped the dough into balls.
            The child shaped the clay.
            Learn to shape dim sum from a master.
            She shapes a rotund jar with a short, narrow lip.
            She shapes elliptical short stories into torched songs of uplifting pessimism.
        </examples>
        <mappings>
            <wn version="3.0">2,3</wn>
            <wn lemma="" version=""/>
            <omega/>
            <pb>shape.01</pb>
        </mappings>
        <SENSE_META clarity=""/>
    </sense>
    
    <sense group="1" n="2" name="influence, give direction" type="">
        <commentary>
            The shaper could be only one factor influencing the final shape.
        </commentary>
        <examples>
            She was shaped by a mother who bound her to excellence.
            Anne was shaped by her political mentors.
            It is clear he was shaped by his early environment.
            The media's primary objective is to shape public opinion.
        </examples>
        <mappings>
            <wn version="3.0">1</wn>
            <wn lemma="" version=""/>
            <omega/>
            <pb>shape.01</pb>
        </mappings>
        <SENSE_META clarity=""/>
    </sense>
    
    <sense group="1" n="3" name="act, form, or progress according to a plan or ideal" type="">
        <commentary>
            includes SHAPE UP
        </commentary>
        <examples>
            Plans are shaping up nicely.
            Shape up your brows; it's the easiest way to transform your look!
            The men's-only fitness center helps shy guys shape up.
            Shape up or ship out!
        </examples>
        <mappings>
            <wn version=""/>
            <wn lemma="shape_up" version="3.0">1</wn>
            <omega/>
            <pb/>
        </mappings>
        <SENSE_META clarity=""/>
    </sense>
    
<sense group="1" n="4" name="none of the above" type="">
  <commentary>
Automatically generated NOTA sense (bbn)
  </commentary>
  <examples>
  </examples>
  <mappings>
    <wn version="2.1"></wn>
    <omega></omega><pb></pb>
    <fn></fn>
  </mappings><SENSE_META clarity=""/>
</sense>
    <WORD_META authors="vieweg,duffielc,brownsw" sample_score="-"/>

<ita count="37" ann_1_2_agreement="0.810810810811" />
</inventory>
