<?xml version="1.0" ?><!DOCTYPE inventory  SYSTEM 'inventory.dtd'><inventory lemma="spread-v">
    <commentary>
    </commentary>
    <sense group="1" n="1" name="(cause to) open to full extent or width" type="">
        <commentary>
            Syntax is: NP1 SPREAD NP2
            Includes: SPREAD OUT
        </commentary>
        <examples>
            He spread his arms wider and gave her a devilish grin.
            The bird spread its wings, as it swooped down on a dead tree near a billboard.
            Orsyn spread the map out so all could see.
            Then slowly, once again, the pianist spread his fingers onto the keys.
            These birds can spread out their toes.
            We spread the picnic rug out on the ground and sat down to eat.
        </examples>
        <mappings>
            <wn version="3.0">4</wn>
            <wn lemma="spread_out" version="3.0">5,7</wn>
            <omega/>
            <pb>spread.03</pb>
        </mappings>
        <SENSE_META clarity=""/>
    </sense>
    <sense group="1" n="2" name="distribute or disseminate; be widespread" type="">
        <commentary>
            Includes: SPREAD OUT, SPREAD OVER
        </commentary>
        <examples>
            She spread butter and jam on the bread.
            Dr. Khronos has been spreading the information about his Vital Energy tapes.
            Spread out the seed and dry thoroughly before placing in a storage container.
            I use a small paint brush to spread varnish over the coil windings.
            The redundancies are spread across the clothing, banking and building industries.
            If we spread the work between us, it won't be so bad.
            They went back to the great hall, and a feast was spread for the king.
            We spread the bicycle parts out on the floor.
            The houses were spread out in a long row.
            A big oil spot spread across the water.
            Spread the news to your friends!
            Rumor and truth spread like wildfire when it came to his antics and sexual adventures.
            The fire ants had spread across the South, causing panic among local populations.
            Group members took signs, lit candles, and spread out along the street.
            The AIDS virus is spread through contact with blood and other body fluids.
            The suburbs spread out for miles to either side of the city.
        </examples>
        <mappings>
            <wn version="3.0">1,2,3,5,6,7,8,10</wn>
            <wn lemma="spread_out" version="3.0">1,2,3,4,6</wn>
            <wn lemma="spread_over" version="3.0">1</wn>
            <omega/>
            <pb>spread.01,spread.02</pb>
        </mappings>
        <SENSE_META clarity=""/>
    </sense>
    <sense group="1" n="3" name="cover" type="">
        <commentary>
            Note: Must include a 'with' PP specifying the cover or spread.
            Syntax is: NP1[agent] SPREAD NP2 with NP3
        </commentary>
        <examples>
            He spread the bread with cheese. (NOTE: compare to example in sense 2)
            Taking a cue from one of their father's sermons, they spread the ground with ash.
            Exhibition openings are often potluck parties where artists spread the table with homemade favorites.
            Eurynome and the nurse spread the bed with soft coverlets.
        </examples>
        <mappings>
            <wn version="3.0">9</wn>
            <omega/>
            <pb>spread.01</pb>
        </mappings>
        <SENSE_META clarity=""/>
    </sense>
    
<sense group="1" n="4" name="none of the above" type="">
  <commentary>
Automatically generated NOTA sense (bbn)
  </commentary>
  <examples>
  </examples>
  <mappings>
    <wn version="2.1"></wn>
    <omega></omega><pb></pb>
    <fn></fn>
  </mappings><SENSE_META clarity=""/>
</sense>
    <WORD_META authors="duffielc,hwangd,brownsw" sample_score="-"/>

<ita count="149" ann_1_2_agreement="0.906040268456" />
</inventory>
