<?xml version="1.0" ?>
<!DOCTYPE inventory SYSTEM "inventory.dtd">
<inventory lemma="flourish-v">    
    <commentary>
    </commentary>
    <sense group="1" n="1" name="Thrive physically, psychologically, or in
   one's career; prosper or grow." type="">  
        <commentary>
        </commentary>
        <examples>
            The deer population in this town is thriving.
            Business is flourishing.
            Pikaia flourished at the same time as the Burgess fauna.
        </examples>
        <mappings>
            <gr_sense></gr_sense>
            <wn version="3.0">1,2</wn>   
            <wn lemma="" version="3.0"></wn>
            <omega></omega><pb>flourish.01</pb>
            <vn>exist-47.1-1,gorge-39.6</vn><fn>Thriving</fn>
        </mappings>
        <SENSE_META clarity=""/>
    </sense>
    <sense group="1" n="2" name="Brandish, usually a firearm." type="">
        <commentary>
        </commentary>
        <examples>
            She flourished her gun for all to see.
            It was better to go to the next town to flourish the pistol.
            It's not like we go around Iraq flourishing ICBMs. 
        </examples>
        <mappings>
            <gr_sense></gr_sense>
            <wn version="3.0">3</wn>
            <wn lemma="" version="3.0"></wn>
            <omega></omega><pb>NM</pb>
            <vn>NM</vn><fn>NM</fn>
        </mappings>
        <SENSE_META clarity=""/>
    </sense>
<sense group="1" n="3" name="none of the above" type="">
  <commentary>
Automatically generated NOTA sense (bbn)
  </commentary>
  <examples>
  </examples>
  <mappings>
    <wn version="2.1"></wn>
    <omega></omega><pb></pb>
    <fn></fn>
  </mappings><SENSE_META clarity=""/>
</sense>
    <WORD_META authors="corvey" sample_score="-"/>
     

<ita count="12" ann_1_2_agreement="0.916666666667" />
</inventory>
