<?xml version="1.0" ?><!DOCTYPE inventory  SYSTEM 'inventory.dtd'><inventory lemma="bias-n">
    <commentary>
    </commentary>
    <sense group="1" n="1" name="A partiality that prevents objective consideration of an issue or situation." type="">
        <commentary>
            BIAS[+abstract]
        </commentary>
        <examples>
            She has a bias concerning her efficiency as a worker.
            We cannot approach the law with bias.
        </examples>
        <mappings>
            <wn version="3.0">1</wn>
            <omega/>
            <pb/>
        </mappings>
        <SENSE_META clarity=""/>
    </sense>
    <sense group="1" n="2" name="A line or cut across a fabric that is not at right angles to a side of the fabric." type="">
        <commentary>
            BIAS[+concrete]
        </commentary>
        <examples>
            The fabric was cut along a bias.
        </examples>
        <mappings>
            <wn version="3.0">2</wn>
            <omega/>
            <pb/>
        </mappings>
        <SENSE_META clarity=""/>
    </sense>
<sense group="1" n="3" name="none of the above" type="">
  <commentary>
Automatically generated NOTA sense (bbn)
  </commentary>
  <examples>
  </examples>
  <mappings>
    <wn version="2.1"></wn>
    <omega></omega><pb></pb>
    <fn></fn>
  </mappings><SENSE_META clarity=""/>
</sense>
    <WORD_META authors="corvey" sample_score="-"/>

<ita count="24" ann_1_2_agreement="0.833333333333" />
</inventory>
