<?xml version="1.0" ?><!DOCTYPE inventory  SYSTEM 'inventory.dtd'><inventory lemma="innovation-n">
    <commentary>
    </commentary>
    
    <sense group="1" n="1" name="something new" type="Abstraction">
        <commentary>
            A new device or process resulting from study, experimentation, or insight; a new creation.
        </commentary>
        <examples>
            New innovations in medicine will allow you to live longer.
            I've created an innovation!
            Shop for the latest in technology innovations.
            When the Heimlich Maneuver was first invented, it was an innovation in health care.
            John's process for reducing chip size won the &quot;Innovation of the Year&quot; award.
        </examples>
        <mappings>
            <wn version="2.0">
                1
            </wn>
            <omega/>
            <pb/>
        </mappings>
        <SENSE_META clarity=""/>
    </sense>
    
    <sense group="1" n="2" name="inventing or starting" type="Event">
        <commentary>
            INNOVATION[+event]
            The act of inventing or beginning something new.
        </commentary>
        <examples>
            We encourage the innovation of new techniques and technologies.
            The innovation of the printing press allowed ideas to spread across Europe.
            Our company is committed to innovation.
            Innovation will always keep the technology industry from stagnating.
        </examples>
        <mappings>
            <wn version="2.0">
                2 3
            </wn>
            <omega/>
            <pb/>
        </mappings>
        <SENSE_META clarity=""/>
    </sense>
    
<sense group="1" n="3" name="none of the above" type="">
  <commentary>
Automatically generated NOTA sense (bbn)
  </commentary>
  <examples>
  </examples>
  <mappings>
    <wn version="2.1"></wn>
    <omega></omega><pb></pb>
    <fn></fn>
  </mappings><SENSE_META clarity=""/>
</sense>
    <WORD_META authors="hertlerb" sample_score="-"/>

<ita count="33" ann_1_2_agreement="0.909090909091" />
</inventory>
