<?xml version="1.0" ?><!DOCTYPE inventory  SYSTEM 'inventory.dtd'><inventory lemma="impress-v">
    <commentary>
    </commentary>
    <sense group="1" n="1" name="have an emotional or cognitive impact on" type="">
        <commentary>
        </commentary>
        <examples>
            The child impressed me as unusually mature.
            Her masterful control of the bow impressed the audience.
            My mother impressed on us kids the importance good hygene.
        </examples>
        <mappings>
            <wn version="3.0">1,2,3</wn>
            <wn lemma="" version="3.0"/>
            <omega/>
            <pb>impress.01,impress.02</pb>
            <vn>amuse-31.1</vn><fn>Experiencer_obj</fn>
        </mappings>
        <SENSE_META clarity=""/>
    </sense>
    <sense group="1" n="2" name="imprint" type="">
        <commentary>
        </commentary>
        <examples>
            To make a batik, you impress a design with wax.
            Typing or otherwise impressing printing on one side of the envelope causes corresponding marks on the message section.
            For the color to take form and impress itself on the stuff, some additional component is needed.
        </examples>
        <mappings>
            <wn version="3.0">4,5,7</wn>
            <omega/>
            <pb>NM</pb>
            <vn>NM</vn><fn>NM</fn>
        </mappings>
        <SENSE_META clarity=""/>
    </sense>
    <sense group="1" n="3" name="conscript; force into service" type="">
        <commentary>
        </commentary>
        <examples>
            The Royal Navy also impressed seamen from inbound British merchant ships at sea.
        </examples>
        <mappings>
            <wn version="3.0">6</wn>
            <omega/>
            <pb>NM</pb>
            <vn>NM</vn><fn>NM</fn>
        </mappings>
        <SENSE_META clarity=""/>
    </sense>
<sense group="1" n="4" name="none of the above" type="">
  <commentary>
Automatically generated NOTA sense (bbn)
  </commentary>
  <examples>
  </examples>
  <mappings>
    <wn version="2.1"></wn>
    <omega></omega><pb></pb>
    <fn></fn>
  </mappings><SENSE_META clarity=""/>
</sense>
    <WORD_META authors="brownsw,greenlm" sample_score="-"/>

<ita count="30" ann_1_2_agreement="0.933333333333" />
</inventory>
