<?xml version="1.0" ?><!DOCTYPE inventory  SYSTEM 'inventory.dtd'><inventory lemma="infect-v">    
    <commentary>
    </commentary>
    <sense group="1" n="1" name="contaminate with a disease or other malicious quality" type="">  
        <commentary>
        </commentary>
        <examples>
            How bad debt infected the world.
            Hackers infected the legitimate website with a malicious script.
            People who were infected with the T virus became zombies.
            The earlier the baby is infected, the more severe the effects.
        </examples>
        <mappings>
            <gr_sense/>
            <wn version="3.0">1,2,3</wn>   
            <wn lemma="" version=""/>
            <omega/>
            <pb>infect.01</pb>
            <vn>fill-9.8</vn><fn/>
        </mappings>
        <SENSE_META clarity=""/>
    </sense>
    <sense group="1" n="2" name="cause a feeling or action" type="">
        <commentary>
        </commentary>
        <examples>
            The teacher always infects everyone with her happiness.
            Something in her terrible agitation infected him strangely.
            Mahan infected the group with a zeal for creative education.
        </examples>
        <mappings>
            <gr_sense/>
            <wn version="3.0">4</wn>
            <wn lemma="" version=""/>
            <omega/>
            <pb/>
            <vn/>
            <fn/>
        </mappings>
        <SENSE_META clarity=""/>
    </sense>
<sense group="1" n="3" name="none of the above" type="">
  <commentary>
Automatically generated NOTA sense (bbn)
  </commentary>
  <examples>
  </examples>
  <mappings>
    <wn version="2.1"></wn>
    <omega></omega><pb></pb>
    <fn></fn>
  </mappings><SENSE_META clarity=""/>
</sense>
    <WORD_META authors="clarklm" sample_score="-"/>
     

<ita count="19" ann_1_2_agreement="1.0" />
</inventory>
