<?xml version="1.0" ?><!DOCTYPE inventory  SYSTEM 'inventory.dtd'><inventory lemma="telescope-n">
    <commentary>
        monosemous
    </commentary>
    
    <sense group="1" n="1" name="an instrument, usually optical,  that magnifies distant objects" type="">
        <commentary>
            TELESCOPE[+artifact][+instrument][+imager][+receptor][+of_wavelength][+electromagnetic][+of_objects][+distant]
        </commentary>
        <examples>
            These data were obtained with radio telescopes.
            John bought his children a refractor telescope to look at the moon with.
        </examples>
        <mappings>
            <wn version="3.0">1</wn>
            <omega/>
            <pb/>
        </mappings>
        <SENSE_META clarity=""/>
    </sense>
    
    
    <WORD_META authors="ahouston" sample_score="-"/>
</inventory>
