<?xml version="1.0" ?>
<!DOCTYPE inventory SYSTEM "inventory.dtd">
<inventory lemma="sieve-v">    
    <commentary>
    </commentary>
    <sense group="1" n="1" name="Distinguish, sort, or separate out." type="">  
        <commentary>
            Includes: SIEVE OUT
            Note: May be metaphorical 
        </commentary>
        <examples>
            The company sieved the job applicants.
            Sieve out those samples from the bad ones.
            The customer sieved through the selection.
        </examples>
        <mappings>
            <gr_sense></gr_sense>
            <wn version="3.0">1,2,4</wn>   
            <wn lemma="sieve_out" version="3.0">1</wn>
            <omega></omega><pb></pb>
            <vn></vn><fn></fn>
        </mappings>
        <SENSE_META clarity=""/>
    </sense>
    <sense group="1" n="2" name="Separate by passing through a straining device." type="">
        <commentary>
        </commentary>
        <examples>
            Sieve the flour before mixing.
            We should sieve the mud from the dig site.  
        </examples>
        <mappings>
            <gr_sense></gr_sense>
            <wn version="3.0">3</wn>
            <wn lemma="" version="3.0"></wn>
            <omega></omega><pb></pb>
            <vn></vn><fn></fn>
        </mappings>
        <SENSE_META clarity=""/>
    </sense>
<sense group="1" n="3" name="none of the above" type="">
  <commentary>
Automatically generated NOTA sense (bbn)
  </commentary>
  <examples>
  </examples>
  <mappings>
    <wn version="2.1"></wn>
    <omega></omega><pb></pb>
    <fn></fn>
  </mappings><SENSE_META clarity=""/>
</sense>
    <WORD_META authors="corvey" sample_score="-"/>
     

<ita count="4" ann_1_2_agreement="0.75" />
</inventory>
