<?xml version="1.0" ?><!DOCTYPE inventory  SYSTEM 'inventory.dtd'><inventory lemma="vacate-v">
    <commentary>
    </commentary>
    <sense group="1" n="1" name="leave or give up a job, post, or tenancy" type="">
        <commentary>
        </commentary>
        <examples>
            Algerian gunmen vacated the flow station yesterday morning, releasing close 
            to 40 Agip staff, soldiers and naval personnel.
            He vacated the office of sheriff in 1999.
            In 2003 he vacated the British Super Middlweight title.
        </examples>
        <mappings>
            <gr_sense/>
            <wn version="3.0">1,2</wn>
            <wn lemma="" version="3.0"/>
            <omega/>
            <pb>vacate.01</pb>
            <vn>escape-51.1,resign-10.11</vn><fn>Quitting_a_place,Departing</fn>
        </mappings>
        <SENSE_META clarity=""/>
    </sense>
    <sense group="1" n="2" name="annul, make legally void" type="">
        <commentary>
        </commentary>
        <examples>
            SciMed Life Systems Inc. said a federal appeals court vacated an earlier 
            summary judgment in its favor. 
            The judge vacated the sentence.
        </examples>
        <mappings>
            <gr_sense/>
            <wn version="3.0">3</wn>
            <omega/>
            <pb>vacate.01</pb>
            <vn>NM</vn><fn>NM</fn>
        </mappings>
        <SENSE_META clarity=""/>
    </sense>
<sense group="1" n="3" name="none of the above" type="">
  <commentary>
Automatically generated NOTA sense (bbn)
  </commentary>
  <examples>
  </examples>
  <mappings>
    <wn version="2.1"></wn>
    <omega></omega><pb></pb>
    <fn></fn>
  </mappings><SENSE_META clarity=""/>
</sense>
    <WORD_META authors="brownsw,greenlm" sample_score="-"/>

<ita count="16" ann_1_2_agreement="0.9375" />
</inventory>
