<?xml version="1.0" ?><!DOCTYPE inventory  SYSTEM 'inventory.dtd'><inventory lemma="trap-v">
    <commentary>
    </commentary>
    <sense group="1" n="1" name="place in a confining or embarassing position" type="">
        <commentary>
            Note: compare to sense 2. This sense is only metaphorical.
        </commentary>
        <examples>
            Deflation has trapped the Federal Reserve into a scenario that will depress the economy.
            The embargo trapped the country in a vice between ruthless insurgents and unloved occupiers.
            Japan had complete miliary control so Korea was trapped in a hopeless situation.
            Are you trapped in procrastination by your decision-making ability?
        </examples>
        <mappings>
            <gr_sense/>
            <wn version="3.0">1</wn>
            <wn lemma="" version=""/>
            <omega/>
            <pb>trap.01</pb>
            <vn>force-59-1</vn><fn/>
        </mappings>
        <SENSE_META clarity=""/>
    </sense>
    <sense group="1" n="2" name="to catch in or as if in a trap; immobilize" type="">
        <commentary>
            Note: Compare to sense 1. This sense only applies to the physical
            properties of a trap.
        </commentary>
        <examples>
            The search-and-rescue teams entered the mine 11 hours after the
            blast trapped the miners.  
            Marc crossed both his blades and trapped Shannon's sword above his head.
            By a clever trick, the children brought down a landslide that
            trapped the serpent. 
            The climber was trapped between the rocks for 5 hours.
        </examples>
        <mappings>
            <gr_sense/>
            <wn version="3.0">2,3,4</wn>
            <wn lemma="" version=""/>
            <omega/>
            <pb>trap.01</pb>
            <vn>pocket-9.10</vn><fn/>
        </mappings>
        <SENSE_META clarity=""/>
    </sense>
<sense group="1" n="3" name="none of the above" type="">
  <commentary>
Automatically generated NOTA sense (bbn)
  </commentary>
  <examples>
  </examples>
  <mappings>
    <wn version="2.1"></wn>
    <omega></omega><pb></pb>
    <fn></fn>
  </mappings><SENSE_META clarity=""/>
</sense>
    <WORD_META authors="clarklm" sample_score="-"/>

<ita count="17" ann_1_2_agreement="0.705882352941" />
</inventory>
