<?xml version="1.0" ?><!DOCTYPE inventory  SYSTEM 'inventory.dtd'><inventory lemma="thick-n">
    <commentary>
        monosemous
    </commentary>
    
    <sense group="1" n="1" name="location of the busiest activity" type="">
        <commentary>
            THICK[+location][+of_activity][+busiest]
        </commentary>
        <examples>
            In the thick of battle it was hard to tell friend from foe.
            Don't bother John while he's in the thick of finals this week.
        </examples>
        <mappings>
            <wn version="3.0">1</wn>
            <omega/>
            <pb/>
        </mappings>
        <SENSE_META clarity=""/>
    </sense>
    
    
    <WORD_META authors="ahouston" sample_score="-"/>
</inventory>
