<?xml version="1.0" ?>
<!DOCTYPE inventory SYSTEM "inventory.dtd">
<inventory lemma="clamp-v">    
    <commentary>
    </commentary>
    <sense group="1" n="1" name="Fasten or fix something to itself or something else." type="">  
        <commentary>
            Note: May be abstract.
        </commentary>
        <examples>
            Clamp the chair together until the glue has hardened.
            John clamped his finger to the board.
            The military clamped a curfew on the populace. 
        </examples>
        <mappings>
            <gr_sense></gr_sense>
            <wn version="3.0">1,2</wn>   
            <wn lemma="" version="3.0"></wn>
            <omega></omega><pb>clamp.01</pb>
            <vn>tape-22.4-1</vn><fn>NP</fn>
        </mappings>
        <SENSE_META clarity=""/>
    </sense>
    <sense group="1" n="2" name="CLAMP DOWN: repress or suppress (something
         regarded as undesireable); deny expression to." type="">
        <commentary>
            Is: CLAMP DOWN
        </commentary>
        <examples>
            The police clamped down on illegal drugs. 
            We have to clamp down on gang elements in the city. 
        </examples>
        <mappings>
            <gr_sense></gr_sense>
            <wn version="3.0"></wn>
            <wn lemma="clamp_down" version="3.0">1</wn>
            <omega></omega><pb>NM</pb>
            <vn>NM</vn><fn>NP</fn>
        </mappings>
        <SENSE_META clarity=""/>
    </sense>
    <sense group="1" n="3" name="CLAMP DOWN: physically bite." type="">
        <commentary>
            Is: CLAMP DOWN 
        </commentary>
        <examples>
            The dog really clamped down.
            I had to clamp down to keep from screaming out in pain. 
        </examples>
        <mappings>
            <gr_sense></gr_sense>
            <wn version="3.0"></wn>
            <wn lemma="" version="3.0"></wn>
            <omega></omega><pb>NM</pb>
            <vn>NM</vn><fn>NP</fn>
        </mappings>
        <SENSE_META clarity=""/>
    </sense>
<sense group="1" n="4" name="none of the above" type="">
  <commentary>
Automatically generated NOTA sense (bbn)
  </commentary>
  <examples>
  </examples>
  <mappings>
    <wn version="2.1"></wn>
    <omega></omega><pb></pb>
    <fn></fn>
  </mappings><SENSE_META clarity=""/>
</sense>
    <WORD_META authors="corvey" sample_score="-"/>
     

<ita count="11" ann_1_2_agreement="1.0" />
</inventory>
