<?xml version="1.0" ?>
<!DOCTYPE inventory SYSTEM "inventory.dtd">
<inventory lemma="defer-v">
    <commentary>
    </commentary>
    <sense group="1" n="1" name="hold back to a later time" type="">
        <commentary>
        </commentary>
        <examples>
            She deferred her entrance to the university for a year.
            The company is offering to defer finance charges for the first year.
        </examples>
        <mappings>
            <gr_sense></gr_sense>
            <wn version="3.0">1</wn>
            <wn lemma="" version="3.0"></wn>
            <omega></omega><pb>defer.01</pb>
            <vn>NM</vn><fn>Change_event_time</fn>
        </mappings>
        <SENSE_META clarity=""/>
    </sense>
    <sense group="1" n="2" name="yield to another's wish or opinion" type="">
        <commentary>
        </commentary>
        <examples>
            I defer to your greater wisdom.
            Must health policy for the uninsured defer to current anti-government sentiment?
            Why would the winner of a footbal coin toss defer to the loser?
        </examples>
        <mappings>
            <gr_sense></gr_sense>
            <wn version="3.0">2</wn>
            <omega></omega><pb>defer.02</pb>
            <vn>acquiesce-95</vn><fn>NM</fn>
        </mappings>
        <SENSE_META clarity=""/>
    </sense>
<sense group="1" n="3" name="none of the above" type="">
  <commentary>
Automatically generated NOTA sense (bbn)
  </commentary>
  <examples>
  </examples>
  <mappings>
    <wn version="2.1"></wn>
    <omega></omega><pb></pb>
    <fn></fn>
  </mappings><SENSE_META clarity=""/>
</sense>
    <WORD_META authors="brownsw,greenlm" sample_score="-"/>

<ita count="24" ann_1_2_agreement="0.791666666667" />
</inventory>
