<?xml version="1.0" ?>
<!DOCTYPE inventory SYSTEM "inventory.dtd">
<inventory lemma="bully-v">    
    <commentary>
    </commentary>
    <sense group="1" n="1" name="Discourage or frighten with threats or a
   domineering manner; intimidate; be bossy towards someone." type="">  
        <commentary>
        </commentary>
        <examples>
            Her big brother always bullied her when she was young.
            Don't bully your classmates!
            It's hard not to bully other students when arguing in class.
        </examples>
        <mappings>
            <gr_sense></gr_sense>
            <wn version="3.0">1,2</wn>   
            <wn lemma="" version="3.0"></wn>
            <omega></omega><pb>bully.01</pb>
            <vn>captain-29.8-1,force-59-1</vn><fn>Manipulate_into_doing</fn>
        </mappings>
        <SENSE_META clarity=""/>
    </sense>
    <sense group="1" n="2" name="BULLY OFF: start a game by face-off." type="">
        <commentary>
            Is: BULLY OFF
        </commentary>
        <examples>
            The two teams bullied off.
            Bully off with your opponent.
        </examples>
        <mappings>
            <gr_sense></gr_sense>
            <wn version="3.0"></wn>
            <wn lemma="bully_off" version="3.0">1</wn>
            <omega></omega><pb>NM</pb>
            <vn>NM</vn><fn>NM</fn>
        </mappings>
        <SENSE_META clarity=""/>
    </sense>
<sense group="1" n="3" name="none of the above" type="">
  <commentary>
Automatically generated NOTA sense (bbn)
  </commentary>
  <examples>
  </examples>
  <mappings>
    <wn version="2.1"></wn>
    <omega></omega><pb></pb>
    <fn></fn>
  </mappings><SENSE_META clarity=""/>
</sense>
    <WORD_META authors="corvey" sample_score="-"/>
     

<ita count="11" ann_1_2_agreement="0.727272727273" />
</inventory>
