<?xml version="1.0" ?>
<!DOCTYPE inventory SYSTEM "inventory.dtd">
<inventory lemma="ditch-v">    
    <commentary>
    </commentary>
    <sense group="1" n="1" name="forsake, sever ties with" type="">  
        <commentary>
        </commentary>
        <examples>
            The British say that he ditched his plane in the Atlantic.
            The company ditched her in no time flat.
        </examples>
        <mappings>
            <gr_sense></gr_sense>
            <wn version="3.0">1,3</wn>   
            <wn lemma="" version="3.0"></wn>
            <omega></omega><pb>NP</pb>
            <vn>NP</vn><fn>NP</fn>
        </mappings>
        <SENSE_META clarity=""/>
    </sense>
    <sense group="1" n="2" name="throw away" type="">
        <commentary>
        </commentary>
        <examples>
            Buergel ditched his notes, saying he'd rather respond to the
            previous speakers.
        </examples>
        <mappings>
            <gr_sense></gr_sense>
            <wn version="3.0">2</wn>
            <wn lemma="" version="3.0"></wn>
            <omega></omega><pb>NP</pb>
            <vn>NP</vn><fn>NP</fn>
        </mappings>
        <SENSE_META clarity=""/>
    </sense>
    <sense group="1" n="3" name="crash, crash-land" type="">
        <commentary>
        </commentary>
        <examples>
            The plane ditched in 3600 feet of shark-infested ocean.
            I ditched my car after it spun out.
        </examples>
        <mappings>
            <gr_sense></gr_sense>
            <wn version="3.0">4,5</wn>
            <wn lemma="" version="3.0"></wn>
            <omega></omega><pb>NP</pb>
            <vn>NP</vn><fn>NP</fn>
        </mappings>
        <SENSE_META clarity=""/>
    </sense>
    <sense group="1" n="4" name="cut a trench in" type="">
        <commentary>
        </commentary>
        <examples>
            Soon after, he fenced and ditched the land and
            built a granary and a stable thereon.
        </examples>
        <mappings>
            <gr_sense></gr_sense>
            <wn version="3.0">6</wn>
            <wn lemma="" version="3.0"></wn>
            <omega></omega><pb>NP</pb>
            <vn>NP</vn><fn>NP</fn>
        </mappings>
        <SENSE_META clarity=""/>
    </sense>
<sense group="1" n="5" name="none of the above" type="">
  <commentary>
Automatically generated NOTA sense (bbn)
  </commentary>
  <examples>
  </examples>
  <mappings>
    <wn version="2.1"></wn>
    <omega></omega><pb></pb>
    <fn></fn>
  </mappings><SENSE_META clarity=""/>
</sense>
    <WORD_META authors="greenlm" sample_score="-"/>
     
</inventory>
