<?xml version="1.0" ?>
<!DOCTYPE inventory SYSTEM "inventory.dtd">
<inventory lemma="scant-v">    
    <commentary>
    </commentary>
    <sense group="1" n="1" name="spare in quality or quantity" type="">  
        <commentary>
        </commentary>
        <examples>
            Our leisure time is scanted by this demanding job.
            Scant must be your takings.
            We had to scant the older children in order to nourish the newborn.
            In the perilous computer market, competition is fierce and profits scant.
            These three writers scanted the middle ground of human intercourse.
            Reforms generally scant the difference between exchange-rate arrangements.
        </examples>
        <mappings>
            <gr_sense></gr_sense>
            <wn version="3.0">1,2,3</wn>   
            <wn lemma="" version="3.0"></wn>
            <omega></omega><pb>scant.01</pb>
            <vn>NP</vn><fn>NP</fn>
        </mappings>
        <SENSE_META clarity=""/>
    </sense>
    <WORD_META authors="conger" sample_score="-"/>
     

<ita count="2" ann_1_2_agreement="1.0" />
</inventory>
