<?xml version="1.0" ?>
<!DOCTYPE inventory SYSTEM "inventory.dtd">
<inventory lemma="jumble-v">    
    <commentary>
    </commentary>
    <sense group="1" n="1" name="Be mixed (up) together." type="">  
        <commentary>
            Syntax Is: NP1[theme] JUMBLE
        </commentary>
        <examples>
            His words jumbled.
            The marbles jumbled as they settled. 
        </examples>
        <mappings>
            <gr_sense></gr_sense>
            <wn version="3.0">1</wn>   
            <wn lemma="" version="3.0"></wn>
            <omega></omega><pb>jumble.01</pb>
            <vn>NM</vn><fn>NM</fn>
        </mappings>
        <SENSE_META clarity=""/>
    </sense>
    <sense group="1" n="2" name="Assemble without order or sense." type="">
        <commentary>
            Syntax Is: NP1[cause] JUMBLE NP2[theme]  
        </commentary>
        <examples>
            She jumbles the words when she writes.
            He jumbled the tickets when he dropped the pile.  
        </examples>
        <mappings>
            <gr_sense></gr_sense>
            <wn version="3.0">2,3</wn>
            <wn lemma="" version="3.0"></wn>
            <omega></omega><pb>jumble.01</pb>
            <vn>shake-22.3-2</vn><fn>Cause_to_amalgamate</fn>
        </mappings>
        <SENSE_META clarity=""/>
    </sense>
<sense group="1" n="3" name="none of the above" type="">
  <commentary>
Automatically generated NOTA sense (bbn)
  </commentary>
  <examples>
  </examples>
  <mappings>
    <wn version="2.1"></wn>
    <omega></omega><pb></pb>
    <fn></fn>
  </mappings><SENSE_META clarity=""/>
</sense>
    <WORD_META authors="corvey" sample_score="-"/>
     

<ita count="6" ann_1_2_agreement="0.666666666667" />
</inventory>
